{
  "$schema": "./mfboard.schema.json",
  "UsbDriveSettings": {
    "VolumeLabel": "RPI-RP2",
    "VerificationFileName": "INFO_UF2.TXT"
  },
  "Connection": {
    "ConnectionDelay": 1250,
    "DelayAfterFirmwareUpdate": 1250,
    "DtrEnable": true,
    "EEPROMSize": 1496,
    "ExtraConnectionRetry": false,
    "ForceResetOnFirmwareUpdate": true,
    "MessageSize": 90
  },
  "HardwareIds": ["^VID_2E8A&PID_000A"],
  "Info": {
    "CanInstallFirmware": true,
    "CanResetBoard": true,
    "FirmwareBaseName": "mobiflight_raspberrypico",
    "FirmwareExtension": "uf2",
    "FriendlyName": "Raspberry Pico",
    "LatestFirmwareVersion": "3.1.4",
    "MobiFlightType": "MobiFlight RaspiPico",
    "ResetFirmwareFile": "reset.raspberry_pico_flash_nuke.uf2",
    "Community": {
      "Project": "MobiFlight",
      "Website": "https://mobiflight.com",
      "Docs": "https://docs.mobiflight.com/boards/recommended/raspberry-pi-pico/",
      "Support": "https://mobiflight.com/discord"
    }
  },
  "ModuleLimits": {
    "MaxAnalogInputs": 3,
    "MaxInputShifters": 6,
    "MaxButtons": 26,
    "MaxEncoders": 13,
    "MaxLcdI2C": 2,
    "MaxLedSegments": 6,
    "MaxOutputs": 26,
    "MaxServos": 8,
    "MaxShifters": 6,
    "MaxSteppers": 6,
    "MaxInputMultiplexer": 6,
    "MaxCustomDevices": 0
  },
  "Pins": [
    {
      "isAnalog": false,
      "isI2C": false,
      "isPWM": true,
      "Pin": 0
    },
    {
      "isAnalog": false,
      "isI2C": false,
      "isPWM": true,
      "Pin": 1
    },
    {
      "isAnalog": false,
      "isI2C": false,
      "isPWM": true,
      "Pin": 2
    },
    {
      "isAnalog": false,
      "isI2C": false,
      "isPWM": true,
      "Pin": 3
    },
    {
      "isAnalog": false,
      "isI2C": true,
      "isPWM": true,
      "Pin": 4
    },
    {
      "isAnalog": false,
      "isI2C": true,
      "isPWM": true,
      "Pin": 5
    },
    {
      "isAnalog": false,
      "isI2C": false,
      "isPWM": true,
      "Pin": 6
    },
    {
      "isAnalog": false,
      "isI2C": false,
      "isPWM": true,
      "Pin": 7
    },
    {
      "isAnalog": false,
      "isI2C": false,
      "isPWM": true,
      "Pin": 8
    },
    {
      "isAnalog": false,
      "isI2C": false,
      "isPWM": true,
      "Pin": 9
    },
    {
      "isAnalog": false,
      "isI2C": false,
      "isPWM": true,
      "Pin": 10
    },
    {
      "isAnalog": false,
      "isI2C": false,
      "isPWM": true,
      "Pin": 11
    },
    {
      "isAnalog": false,
      "isI2C": false,
      "isPWM": true,
      "Pin": 12
    },
    {
      "isAnalog": false,
      "isI2C": false,
      "isPWM": true,
      "Pin": 13
    },
    {
      "isAnalog": false,
      "isI2C": false,
      "isPWM": true,
      "Pin": 14
    },
    {
      "isAnalog": false,
      "isI2C": false,
      "isPWM": true,
      "Pin": 15
    },
    {
      "isAnalog": false,
      "isI2C": false,
      "isPWM": false,
      "Pin": 16
    },
    {
      "isAnalog": false,
      "isI2C": false,
      "isPWM": false,
      "Pin": 17
    },
    {
      "isAnalog": false,
      "isI2C": false,
      "isPWM": false,
      "Pin": 18
    },
    {
      "isAnalog": false,
      "isI2C": false,
      "isPWM": false,
      "Pin": 19
    },
    {
      "isAnalog": false,
      "isI2C": false,
      "isPWM": false,
      "Pin": 20
    },
    {
      "isAnalog": false,
      "isI2C": false,
      "isPWM": false,
      "Pin": 21
    },
    {
      "isAnalog": false,
      "isI2C": false,
      "isPWM": false,
      "Pin": 22
    },
    {
      "isAnalog": true,
      "isI2C": false,
      "isPWM": false,
      "Name": "A0",
      "Pin": 26
    },
    {
      "isAnalog": true,
      "isI2C": false,
      "isPWM": false,
      "Name": "A1",
      "Pin": 27
    },
    {
      "isAnalog": true,
      "isI2C": false,
      "isPWM": false,
      "Name": "A2",
      "Pin": 28
    }
  ]
}