{
  "$schema": "./mfboard.schema.json",
  "AvrDudeSettings": {
    "Attempts": 1,
    "Device": "atmega328p",
    "BaudRates": ["115200"],
    "Programmer": "arduino",
    "Timeout": 15000
  },
  "Connection": {
    "ConnectionDelay": 1750,
    "DelayAfterFirmwareUpdate": 0,
    "DtrEnable": true,
    "EEPROMSize": 286,
    "ExtraConnectionRetry": true,
    "ForceResetOnFirmwareUpdate": false,
    "MessageSize": 90
  },
  "HardwareIds": [
    "^VID_10C4&PID_EA60",
    "^VID_2341&PID_0043",
    "^VID_2A03&PID_0043",
    "^VID_2341&PID_0243",
    "^VID_2341&PID_0001",
    "^VID_1A86&PID_7523",
    "^VID_0403&PID_6001",
    "^VID_0403\\+PID_6001\\+.+"
  ],
  "Info": {
    "CanInstallFirmware": true,
    "CanResetBoard": true,
    "FriendlyName": "Arduino Uno",
    "FirmwareBaseName": "mobiflight_uno",
    "FirmwareExtension": "hex",
    "LatestFirmwareVersion": "3.1.2",
    "MobiFlightType": "MobiFlight Uno",
    "ResetFirmwareFile": "reset.arduino_uno_1_0_2.hex",
    "Community": {
      "Project": "MobiFlight",
      "Website": "https://mobiflight.com/links/connector/info/website/uno.html",
      "Docs": "https://mobiflight.com/links/connector/info/docs/uno.html",
      "Support": "https://mobiflight.com/discord"
    }
  },
  "ModuleLimits": {
    "MaxAnalogInputs": 6,
    "MaxButtons": 18,
    "MaxEncoders": 9,
    "MaxInputShifters": 6,
    "MaxLcdI2C": 2,
    "MaxLedSegments": 6,
    "MaxOutputs": 18,
    "MaxServos": 8,
    "MaxShifters": 6,
    "MaxSteppers": 4,
    "MaxInputMultiplexer": 6,
    "MaxCustomDevices": 0
  },
  "Pins": [
    {
      "isAnalog": false,
      "isI2C": false,
      "isPWM": false,
      "Pin": 2
    },
    {
      "isAnalog": false,
      "isI2C": false,
      "isPWM": true,
      "Pin": 3
    },
    {
      "isAnalog": false,
      "isI2C": false,
      "isPWM": false,
      "Pin": 4
    },
    {
      "isAnalog": false,
      "isI2C": false,
      "isPWM": true,
      "Pin": 5
    },
    {
      "isAnalog": false,
      "isI2C": false,
      "isPWM": true,
      "Pin": 6
    },
    {
      "isAnalog": false,
      "isI2C": false,
      "isPWM": false,
      "Pin": 7
    },
    {
      "isAnalog": false,
      "isI2C": false,
      "isPWM": false,
      "Pin": 8
    },
    {
      "isAnalog": false,
      "isI2C": false,
      "isPWM": true,
      "Pin": 9
    },
    {
      "isAnalog": false,
      "isI2C": false,
      "isPWM": true,
      "Pin": 10
    },
    {
      "isAnalog": false,
      "isI2C": false,
      "isPWM": true,
      "Pin": 11
    },
    {
      "isAnalog": false,
      "isI2C": false,
      "isPWM": false,
      "Pin": 12
    },
    {
      "isAnalog": false,
      "isI2C": false,
      "isPWM": false,
      "Pin": 13
    },
    {
      "isAnalog": true,
      "isI2C": false,
      "isPWM": false,
      "Name": "A0",
      "Pin": 14
    },
    {
      "isAnalog": true,
      "isI2C": false,
      "isPWM": false,
      "Name": "A1",
      "Pin": 15
    },
    {
      "isAnalog": true,
      "isI2C": false,
      "isPWM": false,
      "Name": "A2",
      "Pin": 16
    },
    {
      "isAnalog": true,
      "isI2C": false,
      "isPWM": false,
      "Name": "A3",
      "Pin": 17
    },
    {
      "isAnalog": true,
      "isI2C": true,
      "isPWM": false,
      "Name": "A4",
      "Pin": 18
    },
    {
      "isAnalog": true,
      "isI2C": true,
      "isPWM": false,
      "Name": "A5",
      "Pin": 19
    }
  ]
}